{
  "proposal_id": "PRP-YYYY-XXXX",
  "version": "1.0",
  "status": "DRAFT",
  "issue_date": "YYYY-MM-DD",
  "valid_until": "YYYY-MM-DD",
  "client": {
    "name": "",
    "company": "",
    "contact": {
      "name": "",
      "email": "",
      "phone": ""
    }
  },
  "project": {
    "title": "[Company] — Launch Website Build",
    "summary": "New clinic website on the Launch package, establishing a professional online presence with service pages and booking integration.",
    "objectives": [
      "Professional, conversion-focused clinic website",
      "Clear service and pricing structure",
      "Online booking integration",
      "Mobile-responsive design"
    ]
  },
  "offering": {
    "code": "B1",
    "category": "WEB",
    "name": "Launch"
  },
  "scope": {
    "included": [
      "Website design and build (Launch package scope)",
      "Service pages and content structure",
      "Booking integration",
      "Mobile-responsive layout",
      "Go-live deployment"
    ],
    "deliverables": [
      "Responsive website (desktop and mobile)",
      "Go-live deployment"
    ],
    "exclusions": [
      "Content copywriting beyond the agreed page set",
      "Ongoing changes after go-live (Web Care is separate and optional)",
      "Custom functionality beyond Launch package scope"
    ]
  },
  "timeline": {
    "estimated_delivery": "6 weeks from approval",
    "notes": "Estimated; final schedule confirmed at agreement"
  },
  "commercial_schedule": {
    "currency": "GBP",
    "reference_price": 2250,
    "approved_final_project_price": 2250,
    "setup_fee": null,
    "payment_schedule": [50, 50],
    "recurring_fees": null,
    "care": null,
    "warranty": {
      "code": "W90",
      "label": "90-day Web Launch Warranty",
      "applies": true
    },
    "vat": {
      "status": "UNDETERMINED",
      "note": "VAT status is unresolved; no tax determination is made in this proposal."
    }
  },
  "client_responsibilities": [
    "Timely feedback on content and design review stages",
    "Required copy and imagery before the build stage"
  ],
  "assumptions": [
    "Approved Final Project Price is the contractual commercial basis, not the public From price",
    "No third-party costs are included without prior approval"
  ],
  "next_steps": [
    "Review and confirm this proposal",
    "Following acceptance, a commercial agreement is executed before invoicing"
  ],
  "acceptance": {
    "method": "written",
    "provider": null,
    "status": "PENDING",
    "accepted_by": null,
    "accepted_at": null
  }
}